{
  "version": "moral-trade-api-contract-v0.3-2026-05",
  "purpose": "Public route catalog for the core Moral Trade API surfaces, including privacy class, schema orientation, rate-limit surface, cache posture, and safe fallback behavior.",
  "routes": [
    {
      "key": "moral_trade_health",
      "method": "GET",
      "path": "/api/moral-trade/health",
      "auth": "public",
      "privacyClass": "public_contract",
      "requestSchema": "empty_request",
      "responseSchema": "moral_trade_aggregate_health_response",
      "rateLimitSurface": "public_contract_read",
      "cacheControl": "no_store_dynamic",
      "fallback": "Return ok:false with validator blockers; never silently claim readiness."
    },
    {
      "key": "moral_trade_api_contract",
      "method": "GET",
      "path": "/api/moral-trade/api-contract",
      "auth": "public",
      "privacyClass": "public_contract",
      "requestSchema": "empty_request",
      "responseSchema": "api_contract_response",
      "rateLimitSurface": "public_contract_read",
      "cacheControl": "no_store_dynamic",
      "fallback": "Return API contract validator blockers, implementation audit, route catalog, schema definitions, privacy classes, and test hooks; never expose private participant records."
    },
    {
      "key": "public_offers_collection",
      "method": "GET",
      "path": "/api/offers",
      "auth": "public",
      "privacyClass": "public_contract",
      "requestSchema": "public_offers_collection_request",
      "responseSchema": "public_offers_collection_response",
      "rateLimitSurface": "offer_collection_read",
      "cacheControl": "no_store_dynamic",
      "fallback": "Return filtered worked-example and live listing payloads, visible facets, validator blockers, and zero-live guidance; never expose private wishes, contact details, raw evidence artifacts, personalized saved-offer state, or global moral ranking."
    },
    {
      "key": "public_offer_detail",
      "method": "GET",
      "path": "/api/offers/:slug",
      "auth": "public",
      "privacyClass": "public_contract",
      "requestSchema": "public_offer_detail_request",
      "responseSchema": "public_offer_detail_response",
      "rateLimitSurface": "offer_detail_read",
      "cacheControl": "no_store_dynamic",
      "fallback": "Return a validator-backed public listing detail or 404 blockers; never expose contact details, private wishes, raw evidence artifacts, personalized saved-offer state, or agreement formation claims."
    },
    {
      "key": "public_offers_facets",
      "method": "GET",
      "path": "/api/offers/facets",
      "auth": "public",
      "privacyClass": "public_contract",
      "requestSchema": "public_offers_facets_request",
      "responseSchema": "public_offers_facets_response",
      "rateLimitSurface": "offer_facets_read",
      "cacheControl": "no_store_dynamic",
      "fallback": "Return positive-count public facets, current default-tab behavior, and validator blockers; never expose zero-count private-sensitive facets or personalized browse state."
    },
    {
      "key": "saved_search_create",
      "method": "POST",
      "path": "/api/saved-searches",
      "auth": "authenticated",
      "privacyClass": "authenticated_private",
      "requestSchema": "saved_search_create_request",
      "responseSchema": "saved_search_create_response",
      "rateLimitSurface": "saved_search_write",
      "cacheControl": "private_no_store",
      "fallback": "Require viewer authentication to store a saved search; unauthenticated requests return a sign-in draft without storage. Never expose private wishes, contact details, raw source notes, personalized saved-offer state, autonomous outreach, or platform moral ranking."
    },
    {
      "key": "public_offer_follow",
      "method": "POST",
      "path": "/api/offers/:id/follow",
      "auth": "authenticated",
      "privacyClass": "authenticated_private",
      "requestSchema": "public_offer_follow_request",
      "responseSchema": "public_offer_follow_response",
      "rateLimitSurface": "offer_follow_write",
      "cacheControl": "private_no_store",
      "fallback": "Require viewer authentication and a live public offer id before writing a viewer-owned saved-offer record. Never expose private wishes, contact details, raw source notes, personalized saved-offer state, public social-follow counts, autonomous outreach, or agreement formation claims."
    },
    {
      "key": "public_offer_create_similar",
      "method": "POST",
      "path": "/api/offers/:id/create-similar",
      "auth": "authenticated",
      "privacyClass": "authenticated_private",
      "requestSchema": "public_offer_create_similar_request",
      "responseSchema": "public_offer_create_similar_response",
      "rateLimitSurface": "offer_create_similar",
      "cacheControl": "private_no_store",
      "fallback": "Require viewer authentication and a live public offer id before returning a review-required draft prefill. Never store before auth, copy private wishes, contact details, raw source notes, evidence URLs, personalized saved-offer state, autonomous outreach, global moral ranking, escrow, or agreement formation claims."
    },
    {
      "key": "moral_trade_data_model_contract",
      "method": "GET",
      "path": "/api/moral-trade/data-model/contract",
      "auth": "public",
      "privacyClass": "public_contract",
      "requestSchema": "empty_request",
      "responseSchema": "data_model_contract_response",
      "rateLimitSurface": "public_contract_read",
      "cacheControl": "no_store_dynamic",
      "fallback": "Return data-model contract validation blockers; never expose private wishes, source notes, saved searches, privacy grants, payment records, or raw feeds."
    },
    {
      "key": "moral_trade_policy_bundle_contract",
      "method": "GET",
      "path": "/api/moral-trade/policy-bundle/contract",
      "auth": "public",
      "privacyClass": "public_contract",
      "requestSchema": "empty_request",
      "responseSchema": "policy_bundle_contract_response",
      "rateLimitSurface": "public_contract_read",
      "cacheControl": "no_store_dynamic",
      "fallback": "Return policy-bundle validation blockers; never use broad app context, hidden reasoning, private feeds, unlisted factor codes, or unseeded prohibited patterns."
    },
    {
      "key": "moral_trade_provenance_schema",
      "method": "GET",
      "path": "/api/moral-trade/provenance/schema",
      "auth": "public",
      "privacyClass": "public_contract",
      "requestSchema": "empty_request",
      "responseSchema": "provenance_schema_response",
      "rateLimitSurface": "public_contract_read",
      "cacheControl": "no_store_dynamic",
      "fallback": "Return schema metadata, validator status, sample-bundle summary, and blockers; never expose submitted evidence artifacts."
    },
    {
      "key": "moral_trade_schema_registry",
      "method": "GET",
      "path": "/api/moral-trade/schemas",
      "auth": "public",
      "privacyClass": "public_schema",
      "requestSchema": "empty_request",
      "responseSchema": "schema_registry_response",
      "rateLimitSurface": "public_contract_read",
      "cacheControl": "no_store_dynamic",
      "fallback": "Return schema registry validation blockers and public schema documents; never hide the data-model schema behind prose-only contracts."
    },
    {
      "key": "moral_trade_copilot_contract",
      "method": "GET",
      "path": "/api/moral-trade/copilot/contract",
      "auth": "public",
      "privacyClass": "public_contract",
      "requestSchema": "empty_request",
      "responseSchema": "copilot_contract_response",
      "rateLimitSurface": "public_contract_read",
      "cacheControl": "no_store_dynamic",
      "fallback": "Return contract validation blockers; invalid copilot output cannot change proposal state."
    },
    {
      "key": "moral_trade_copilot_review",
      "method": "POST",
      "path": "/api/moral-trade/copilot/review",
      "auth": "optional",
      "privacyClass": "ephemeral_private_draft_review",
      "requestSchema": "copilot_review_request",
      "responseSchema": "copilot_review_response",
      "rateLimitSurface": "copilot_draft_review",
      "cacheControl": "private_no_store",
      "fallback": "Return request, evidence-metadata, or output validation blockers and deterministic manual-review fallback metadata; never store the submitted draft, raw evidence artifacts, contact counterparties, or change proposal state."
    },
    {
      "key": "moral_trade_match_signal_contract",
      "method": "GET",
      "path": "/api/moral-trade/match-signal/contract",
      "auth": "public",
      "privacyClass": "public_contract",
      "requestSchema": "empty_request",
      "responseSchema": "match_signal_contract_response",
      "rateLimitSurface": "public_contract_read",
      "cacheControl": "no_store_dynamic",
      "fallback": "Return match-signal contract validation blockers; redacted matching cannot disclose, contact, rely, or change proposal state without human review."
    },
    {
      "key": "moral_trade_match_signal_evaluate",
      "method": "POST",
      "path": "/api/moral-trade/match-signal/evaluate",
      "auth": "optional",
      "privacyClass": "ephemeral_private_draft_review",
      "requestSchema": "match_signal_evaluate_request",
      "responseSchema": "match_signal_evaluate_response",
      "rateLimitSurface": "match_signal_evaluate",
      "cacheControl": "private_no_store",
      "fallback": "Return redacted match-signal blockers and no-state-change fallback metadata; never store submitted redacted profiles, reveal exact wishes, contact counterparties, or rank moral value."
    },
    {
      "key": "moral_trade_challenge_appeal_contract",
      "method": "GET",
      "path": "/api/moral-trade/challenge-appeal/contract",
      "auth": "public",
      "privacyClass": "public_contract",
      "requestSchema": "empty_request",